{
  "$schema": "https://json-schema.org/draft/2020-12/schema",
  "title": "NanoLab Work Event v1",
  "type": "object",
  "additionalProperties": false,
  "required": ["schema_version", "event_id", "timestamp_utc", "execution_id", "work_order_id", "event_type", "actor_role", "subject_sha", "summary"],
  "properties": {
    "schema_version": {"const": 1},
    "event_id": {"type": "string", "pattern": "^[0-9]{4}-[a-z0-9-]+$"},
    "timestamp_utc": {"type": "string", "format": "date-time"},
    "execution_id": {"type": "string"},
    "work_order_id": {"type": "string"},
    "event_type": {"description": "Standard work-order lifecycle events; REVIEW_CORRECTIONS (schema sync, control WO EX-CTRL-LINTSCHEMA-R1) is the dedicated post-terminal review-corrections marker and scripts/harness/work_cli.py additionally requires it to appear only after the terminal/handoff event authored by REVIEWER, VERIFIER or DIRECTOR (docs/infra/VALIDATION_GATES_R1.md section 2). External executor campaigns (NL5-002 lineage; profile opened by EXTERNAL_EXECUTOR_DISPATCHED, enforced by scripts/harness/work_cli.py with ORCHESTRATOR as the only actor role, exactly one dispatch opener and exactly one EXTERNAL_RUN_COMPLETED terminal) additionally use EXTERNAL_EXECUTOR_DISPATCHED / CONTINUATION / EXTERNAL_RUN_COMPLETED. Known accepted divergence (science integration 2026-09-30; precedent LEGACY_ABBREVIATED_SHA_EVENTS): scripts/harness/work_cli.py (the enforcement floor) tolerates the out-of-enum value END_ANALYSIS ONLY for the single immutable fresh-verified legacy event whitelisted in LEGACY_END_ANALYSIS_EVENTS (EX-NL5-002-E-R1 event 0007-continuation-paired-analysis-and-handoff, published on the science closure branch and verified before integration); that event remains invalid by this schema (this schema is the ceiling), the vocabulary is not opened for new events. See config/control/harness/README.md and docs/infra/VALIDATION_GATES_R1.md section 2.", "enum": ["WORK_ORDER_STARTED", "CONTINUATION_CHECKPOINT", "IMPLEMENTATION_COMMITTED", "VALIDATION_RECORDED", "BLOCKER_RECORDED", "REPAIR_STARTED", "REPAIR_COMPLETED", "REVIEW_RECORDED", "REVIEW_CORRECTIONS", "HANDOFF_COMPLETED", "WORK_ORDER_BLOCKED", "WORK_ORDER_CANCELLED", "EXTERNAL_EXECUTOR_DISPATCHED", "CONTINUATION", "EXTERNAL_RUN_COMPLETED"]},
    "actor_role": {"description": "ORCHESTRATOR is reserved for external executor campaigns (external execution profile; see event_type description).", "enum": ["IMPLEMENTER", "SCIENTIFIC_OPERATOR", "REVIEWER", "VERIFIER", "DIRECTOR", "ORCHESTRATOR"]},
    "subject_sha": {"description": "Strictly a full 40-hex git SHA for every event. Known accepted divergence: scripts/harness/work_cli.py (the enforcement floor) tolerates the abbreviated 7-hex value 9cc83e8 ONLY for the four immutable legacy events whitelisted in LEGACY_ABBREVIATED_SHA_EVENTS (EX-NL1-002-R1 events 0002-0005) that are already published on canonical main; those four events remain invalid by this schema (this schema is the ceiling). See config/control/harness/README.md.", "type": "string", "pattern": "^[0-9a-f]{40}$"},
    "summary": {"type": "string", "minLength": 1},
    "command_refs": {"type": "array", "items": {"type": "string"}},
    "evidence_refs": {"type": "array", "items": {"type": "string"}},
    "next_action": {"type": ["string", "null"]},
    "blocker": {"type": ["string", "null"]},
    "sequence": {"type": "integer", "minimum": 1},
    "timestamp_source": {"const": "machine", "description": "Clock source declaration, not independent identity/attestation proof."}
  }
}
