{
  "schema_version": 1,
  "event_id": "0003-handoff-completed",
  "timestamp_utc": "2026-10-05T16:20:03Z",
  "execution_id": "EX-NL5-V02-DIRECTOR-FREEZE-R2",
  "work_order_id": "WO-NL5-V02-DIRECTOR-FREEZE-R2",
  "event_type": "HANDOFF_COMPLETED",
  "actor_role": "IMPLEMENTER",
  "subject_sha": "a2f7304ebbb5973b81cf49dee60c21c85c6a974d",
  "summary": "HANDOFF: FROZEN_R2 REPAIR COMPLETE — M-1 = FIXED; corrected immutable FROZEN PACKAGE COMMIT F2 created, published and never to be amended; Director FREEZE R2 recorded in a strict descendant commit. BASE_HANDOFF = R1 handoff control/nl5-v02-director-freeze-r1 @ 49bda9bad9110c4598d10aa20a28cf5b062acf13 (reviewer branch review/nl5-v02-frozen-r1-scientific-review-r1 merged --no-ff, merge 8ec75bc0d7ab076ec72a3f0fdb370d7ee66f3674). TOOLING_REPAIR_HEAD = db8227a (Phase A: fail-closed FROZEN-only scan-allowlist-v1 binding in scripts/nl5/repro_v02_freeze_contract.py + ScanAllowlistBindingTest 12 regression tests; pushed before F2). F1_HEAD = cb91ade761f6802fc40c500761d3e35022408822 UNCHANGED = YES (immutable ancestor; frozen artifacts byte-identical, Director R1 records untouched). FROZEN SUBJECT (exact review/verify target): F2_HEAD = 60da9a846511265a8ac7564da088c3d74cb073f0, F2_TREE = e565c8a6cee9e829fac14008ebc9c2ea1609931d (rev-parse F2^{tree} == F2_TREE proven; published non-force db8227a..60da9a8; amend/rewrite forbidden). Exact Git blobs of F2: frozen protocol docs/research/NANOLAB_REPRO_V0_2_FROZEN_R2.md — blob 4835719622bae49a8e8b480536a482b4b222d408, canonical_sha256 2658ee3e0cd0216245f0ab63b67f73969d2d060e703e2e94819e0d93fc997c6d; frozen contract docs/work/executions/EX-NL5-V02-DIRECTOR-FREEZE-R2/evidence/repro-v0-2-freeze-contract-FROZEN_R2.json — blob d6a9ccde4d1dadf42d1a8cd9b88faa02646cf70b, canonical_sha256 7e6476544e82af73d5d7e0672666ece99bf4d499a0da30645b02886bcdc45b3a; frozen seed record docs/work/executions/EX-NL5-V02-DIRECTOR-FREEZE-R2/evidence/repro-v0-2-seed-record-FROZEN_R2.json — blob 0164e0e3f5dda6dbf63174df3730b1bd921d2c76, canonical_sha256 8e844bff299df82bcbc5d524b5881de56190a59fc8e39a4a8bdeeddc97fa7e28 (SAME Git blob as FROZEN_R1; byte-identical to accepted R4 PRE-DATA seed record; cmp clean; SEED_BYTE_IDENTICAL_R4_F1 = YES). ALLOWLIST_CONTRACT = ALLOWLIST_PROTOCOL = docs/research/NANOLAB_REPRO_V0_2_CANDIDATE_R1.md + docs/work/executions/EX-NL5-V02-PREFREEZE-HARDENING-R4/evidence/repro-v0-2-seed-record-PRE_DATA_R4.json (pinned scan tree a9d7d07fa264e9907b67ca244b00ba2da3430b0f; FROZEN_R2 package paths are NOT allowlist entries; ordered exact machine binding scan-allowlist-v1 <-> seed_generation.scan_allowlist_paths_exact). ALLOWLIST_REGRESSION = PASS (positive: corrected FROZEN allowlist -> gate PASS incl. full scan re-run; negatives: frozen-package paths -> FREEZE_GATE_FAIL exit 3, raw FROZEN_R1 protocol -> FREEZE_GATE_FAIL exit 3, missing/duplicate/malformed/order-drift/extra -> FREEZE_GATE_FAIL; PRE-DATA R4 historical package stays PASS; evidence m1-negative-control-R2.json). CONTRACT_UNEXPECTED_SCIENTIFIC_DELTA = NONE (delta vs PRE_DATA_R4 = exactly candidate_doc_path / seed_record_path / freeze_status; 307/310 leaves unchanged; frozen-package-delta-check-R2.json PASS). DIRECTOR_FREEZE_R2_COMMIT = a2f7304ebbb5973b81cf49dee60c21c85c6a974d — СТРОГИЙ ПОТОМОК F2 (merge-base --is-ancestor proven); DIRECTOR_FREEZE_R2.json — git_blob_sha1 68d8b868bc0a4a4d4fa02c07d81ce9832a48c37a, canonical_sha256 766ed0602ec68797738985621785178d3867062f80c233776423cc10ff0ead93; DIRECTOR_FREEZE_R2.md — git_blob_sha1 bfae1672f9f689fad1bc6a3369f9c95378c3ecf9, canonical_sha256 27d4e5c556652f0819e0388ead35742f6de2988a61e40592879c6e50c38ac5f1; record_kind = DIRECTOR_FREEZE_RECORD, issuer_class = DIRECTOR, decision = FREEZE; pins F2_HEAD/F2_TREE + exact artifact digests + HG-B binding (source_commit 549b687a9171ea3636dbb00078d7018f619cebd3, path docs/evidence/NL5-ACCEPTANCE-POLICY/HG_B_OWNER_DECISION_R1.json, git_blob_sha1 61d1491233aeb2537f9800d6183def5b8fb0c8e0, canonical_sha256 b68dd341a5671d6314da3fcf6d32fae54f88b385b7b5a631edb07b0f6f49d2c9); disposition: FROZEN_R1/Director R1 = historical immutable attempt, review FIX_REQUIRED, superseded for dispatch by FROZEN_R2. FROZEN_GATE = PASS / PREFREEZE_VALIDATION_PASS / freeze_status FROZEN / dispatch DISPATCH_BLOCKED / dispatch_ready false (frozen-gate-PASS-R2.json, full pinned-scan re-run). NEGATIVE_WRONG_ALLOWLIST = FREEZE_GATE_FAIL / exit 3. ВАЛИДАЦИЯ на этом handoff-коммите: python3 -m unittest discover -s tests -t . = Ran 605 tests, OK (было 593; +12 ScanAllowlistBindingTest); check-consistency ok (errors [], warnings []); workflow_lint workflows 1, violations 0, blocking 0; work_cli validate 51/51 EX-* ok. ГРАНИЦЫ НЕ ИЗМЕНЕНЫ: SCIENTIFIC_RUNS = 0; HG-B = APPROVED; NL5 = IN_PROGRESS; NL6-001 = LOCKED; AUTHOR_U1 = NOT_ASSIGNED; R2 = WAITING_HOST / NOT_ACTIVE; external_reproductions = 0; machine_launch_authorized = false; launch_gate = HUMAN_PROTECTED_WRITER; project/state.json не изменялся. R2 = WAITING_HOST / NOT_ACTIVE. Событие append-only; события 0001/0002, F1, F2 и D2 не редактируются. NEXT_ACTOR: fresh SCIENTIFIC REVIEWER(F2) на exact F2_HEAD 60da9a846511265a8ac7564da088c3d74cb073f0 / F2_TREE e565c8a6cee9e829fac14008ebc9c2ea1609931d (reviewed_head/tree = F2; NOT F1, NOT D2/bookkeeping); затем fresh independent VERIFIER(F2); затем отдельный authority-builder WO (A). НЕ НАЧИНАТЬ SCIENCE.",
  "command_refs": [
    "python3 -m unittest discover -s tests -t . -> Ran 605 tests, OK",
    "PYTHONPATH=scripts python3 -m harness.cli check-consistency --root . -> ok:true, errors [], warnings []",
    "PYTHONPATH=scripts python3 -m harness.workflow_lint --root . -> workflows 1, violations 0, blocking 0",
    "PYTHONPATH=scripts python3 -m harness.work_cli validate <EX-*> -> 51/51 ok",
    "git merge-base --is-ancestor 60da9a846511265a8ac7564da088c3d74cb073f0 a2f7304ebbb5973b81cf49dee60c21c85c6a974d -> exit 0",
    "git diff cb91ade HEAD -- docs/research/NANOLAB_REPRO_V0_2_FROZEN_R1.md docs/work/executions/EX-NL5-V02-DIRECTOR-FREEZE-R1/evidence/ -> frozen artifacts byte-identical (only R1-era control/bookkeeping files differ, unchanged from 49bda9b)",
    "git push origin repair/nl5-v02-director-freeze-r2 (non-force)"
  ],
  "evidence_refs": [
    "docs/research/NANOLAB_REPRO_V0_2_FROZEN_R2.md",
    "docs/work/executions/EX-NL5-V02-DIRECTOR-FREEZE-R2/evidence/repro-v0-2-freeze-contract-FROZEN_R2.json",
    "docs/work/executions/EX-NL5-V02-DIRECTOR-FREEZE-R2/evidence/repro-v0-2-seed-record-FROZEN_R2.json",
    "docs/work/executions/EX-NL5-V02-DIRECTOR-FREEZE-R2/evidence/frozen-gate-PASS-R2.json",
    "docs/work/executions/EX-NL5-V02-DIRECTOR-FREEZE-R2/evidence/frozen-package-delta-check-R2.json",
    "docs/work/executions/EX-NL5-V02-DIRECTOR-FREEZE-R2/evidence/m1-negative-control-R2.json",
    "docs/work/executions/EX-NL5-V02-DIRECTOR-FREEZE-R2/evidence/seed-record-identity-R2.json",
    "docs/work/executions/EX-NL5-V02-DIRECTOR-FREEZE-R2/evidence/REPAIR_MAP_M1.md",
    "docs/evidence/NL5-V02-FREEZE/DIRECTOR_FREEZE_R2.md",
    "docs/evidence/NL5-V02-FREEZE/DIRECTOR_FREEZE_R2.json",
    "docs/evidence/NL5-V02-FREEZE/FRESH_SCIENTIFIC_REVIEW_R1.md"
  ],
  "next_action": "fresh SCIENTIFIC REVIEWER(F2) на exact F2_HEAD/F2_TREE (60da9a846511265a8ac7564da088c3d74cb073f0 / e565c8a6cee9e829fac14008ebc9c2ea1609931d) с проверкой scan-allowlist binding; только при PASS — fresh independent VERIFIER(F2); затем authority-builder WO (A). Science / R2 activation / AUTHOR_U1 assignment / NL6 unlock не начинать.",
  "blocker": null
}
