{
  "schema_version": 1,
  "event_id": "0003-handoff-completed",
  "timestamp_utc": "2026-09-18T10:47:00Z",
  "execution_id": "EX-NL5-001-D-R1",
  "work_order_id": "NL5-001-D-R1",
  "event_type": "HANDOFF_COMPLETED",
  "actor_role": "IMPLEMENTER",
  "subject_sha": "50aee77760e73e8399a703566fd3bb0082dc9fbd",
  "summary": "NL5-001-D implementation complete. Owner D2 is durably recorded and applied; nanolab-components 0.1.0 metadata is deterministic; hosted CI on substantive subject passed 5/5 with 360 tests. Scientific/reproduction surfaces are unchanged. Handoff is for fresh independent review and exact-head verification; canonical acceptance and merge are not claimed.",
  "command_refs": [
    "hosted-ci 35336208105 = SUCCESS",
    "unittest discover = 360 tests OK"
  ],
  "evidence_refs": [
    "docs/work/executions/EX-NL5-001-D-R1/summary.md",
    "docs/control/NL5_001_D_LICENSE_DECISION_R1.md",
    "releases/nanolab-components-v0.1/RELEASE_MANIFEST.json"
  ],
  "next_action": "REVIEWER (fresh, independent): review PR #42 final exact head; then separate Fresh Verifier; Human Gate merge; Director acceptance of NL5-001 afterward.",
  "blocker": null
}
