{
  "schema_version": 1,
  "event_id": "0004-handoff-completed",
  "timestamp_utc": "2026-10-11T12:06:00Z",
  "execution_id": "EX-INFRA3-U2-OUTENEMY-READINESS-R1",
  "work_order_id": "WO-INFRA3-U2-OUTENEMY-READINESS-R1",
  "event_type": "HANDOFF_COMPLETED",
  "actor_role": "DIRECTOR",
  "subject_sha": "b87d61d1a101e8b85415a079288efa46384be201",
  "summary": "EX-INFRA3-U2-OUTENEMY-READINESS-R1 HANDOFF_COMPLETED (branch infra/u2-outenemy-executor-readiness-r1; implementation state b87d61d1a101e8b85415a079288efa46384be201 incl. tooling-repair R1; 0 scientific runs; PR #55). EXECUTED FACTS (machine evidence in evidence/): host outenemy = pinned U2/P-B per FROZEN_R2 section 5 (native Ubuntu 22.04.5, systemd-detect-virt=none, Linger=yes; r2 check-host NOT_ELIGIBLE - canonical negative control correct); own P-B build chain: pinned oxDNA 00dc7fb9 CPU/Release/DOUBLE=ON/CUDA=OFF/MPI=OFF, binary 6effd00a... reproduced byte-for-byte by clean rebuild (~67 s), full provenance via scripts/r2/engine_build.py (U1 CLI guard NOT bypassed); technical engine smoke exit 0 (NOT a scientific claim); release package v0.1.1 fresh git-archive self-test = exactly the 7 documented pyc findings -> bounded v0.1.2 packaging repair prepared separately (work/nl5-v012-packaging-pyc-repair-r1, PR #56); systemd user-manager mechanics machine-verified; storage ~/nanolab/{workspaces,raw,cache,tools} + raw projection ~15 GB with 80% monitoring threshold; TOOLING repairs F-1..F-3 + scope-repair via WO-INFRA3-R2-TOOLING-REPAIR-R1 (event 0003 of this execution) + F-4 ambiguous-binary fail-closed + separate U2 executor path run-u2 prepared and end-to-end machine-checked on disposable technical fixtures (evidence/u2-dispatch-fixture-selftest-R1.json). VALIDATION: full suite 630 tests OK on this host; work_cli validate = ok for both executions on the branch; check-consistency ok; workflow_lint blocking=0; hosted CI runs on push (PR #55 head). BOUNDARIES UNCHANGED AT HANDOFF: R2 = WAITING_HOST / NOT_ACTIVE; AUTHOR_U1 = NOT_ASSIGNED; NL5 = IN_PROGRESS; external_reproductions = 0; F2/frozen artifacts untouched; canonical statuses untouched; no real dispatch authority; merge = Human Gate. OPEN RISKS: machine shared with unrelated workloads (microk8s/docker; RAM available ~26 GiB at audit) - campaign WO must fix budget; U1 still unassigned (hard blocker for R2 activation). NEXT ACTION: fresh independent Reviewer on exact branch HEAD/TREE -> narrow repair if needed -> fresh independent Verifier on final exact HEAD/TREE (owner mission step 1.7); then owner Human Gate on PR #55."
}
