{
  "schema_version": 1,
  "event_id": "0004-handoff-completed",
  "timestamp_utc": "2026-10-18T14:16:05Z",
  "execution_id": "EX-INFRA3-NL5-READINESS-R1",
  "work_order_id": "WO-INFRA3-NL5-READINESS-R1",
  "event_type": "HANDOFF_COMPLETED",
  "actor_role": "IMPLEMENTER",
  "subject_sha": "d8842c2f51870cbf3adf5eae28078ff9d996aa31",
  "summary": "EX-INFRA3-NL5-READINESS-R1 HANDOFF_COMPLETED (branch infra/infra3-nl5-readiness-r1; implementation subject d8842c2f51870cbf3adf5eae28078ff9d996aa31 / tree 2b49d54ff8c122ef5112442a75afe57dd56ca7e2; terminal packaging commit appends events/evidence-map/summary on top; exact final HEAD/TREE in summary.md; 0 scientific runs; DRY-RUN ONLY). DELIVERED: (1) docs/infra/U1_PROVISIONING_CHECKLIST_R1.md - machine-checkable provisioning requirements for physical U1=AUTHOR_UBUNTU (INV-1..INV-4 U1 != U2 != Windows/WSL2 incl. outenemy EXTERNAL_U2_ONLY deny-list; HW/OS/disk/network isolation; exact fingerprint command procedure per ENGINE_ENVIRONMENT_R2 section 4+9; oxDNA provenance pin 00dc7fb9a25bbd8cadbc7503ee2b9f38983c6591 CPU/Release/DOUBLE=ON/CUDA=OFF/MPI=OFF; dependency list; SSH/CI isolation per SECURITY_MODEL - public PR code never on trusted scientific nodes; systemd survival + linger + separate CI unit; proof procedure of three-way distinctness; human actions A1-A6); every row status HOST_NOT_ASSIGNED. (2) docs/infra/NL5_V02_DRYRUN_MANIFEST_R1.json - machine-readable dry-run manifest skeleton bound to frozen FROZEN_R2 (protocol sha256 2658ee3e0cd0216245f0ab63b67f73969d2d060e703e2e94819e0d93fc997c6d verified from disk; F2 60da9a846511265a8ac7564da088c3d74cb073f0, tree e565c8a6cee9e829fac14008ebc9c2ea1609931d; authoritative contract + seed record + Director FREEZE R2 pins cross-checked); campaign numbers re-derived from the canonical frozen protocol, NOT from mission text: 296 confirmatory = 2*(64+64+10+10), replacement cap 56, max 352, wall <=560h/platform, N_min 52/8, SELECTED_N=64; run id scheme nl5v02-<leg>-<variant>-r<NNNN> + attempt semantics (<run_base> / <run_base>-R<n>, reuse forbidden); input digests PENDING_DISPATCH placeholders; U1 author / outenemy U2 independent-reproduction-only split; gates U1-U5 + NC-U1..NC-U5 as complete machine-checkable entries (id/description/check/artifact/pass condition/status); dispatch BLOCKED; launch gate HUMAN_PROTECTED_WRITER; machine_launch_authorized=false. (3) docs/infra/INFRA3_NL5_READINESS_REPORT_R1.md - HOST_NOT_ASSIGNED declaration, per-gate table (all HOST_NOT_ASSIGNED), merged-vs-review-verified reconciliation (PRs #45/#46/#47/#52/#53/#55/#56 all merged ancestors of canonical main at 513c4fa; NO review-verified-but-unmerged infra fact remains; no U1/gate-PASS/R2-ACTIVE fact exists anywhere), human actions A1-A6, forbidden-until-Human-Gate list. (4) tests/test_infra3_nl5_readiness.py - 30 offline unit tests, all green. VALIDATION: 709 tests OK; check-consistency ok (head d8842c2f, tree 2b49d54f); workflow_lint blocking=0; work_cli validate ok (see summary.md). BOUNDARIES UNCHANGED: frozen NL5 v0.2 artifacts untouched (digests re-verified); project/state.json, project/infra-state.json, project/plan.json untouched; no runner registration/credentials/paid compute; no scientific run; outenemy not proposed as author; NL5=IN_PROGRESS, NL6-001=LOCKED, external_reproductions=0, R2=WAITING_HOST/NOT_ACTIVE, AUTHOR_U1=NOT_ASSIGNED, NEW_SCIENCE=HARD_BLOCKED. OPEN RISKS: U1 unassigned (hard blocker, owner action A1-A6 required); provisioning checklist hardware floor is derived from U2 raw-capacity precedent and must be re-validated against the actual host fingerprint. NEXT ACTION: fresh independent Reviewer + fresh exact-head Verifier of this branch, then Human Gate (merge)."
}
